{
  "assessment_payload_read": false,
  "evidence_scope": "engineering_screen_not_scientific_validation",
  "gate": "J0",
  "nominal_artifact_id": "aaaaaaaaaaaaaaaaaaaaaaaaaaaaaaaaaaaaaaaaaaaaaaaaaaaaaaaaaaaaaaaa",
  "parent_source": {
    "population_id": "synthetic-example-population",
    "prepared_artifact_id": "aaaaaaaaaaaaaaaaaaaaaaaaaaaaaaaaaaaaaaaaaaaaaaaaaaaaaaaaaaaaaaaa",
    "role": "template",
    "source_nominal_artifact_id": "aaaaaaaaaaaaaaaaaaaaaaaaaaaaaaaaaaaaaaaaaaaaaaaaaaaaaaaaaaaaaaaa",
    "source_path": "synthetic://prepared"
  },
  "policy": {
    "policy": "engineering_screen_not_scientific_validation",
    "projection_atol": 1e-10,
    "projection_rtol": 1e-10,
    "q": 0.5,
    "replicas": 200,
    "required_failures_per_seed": 0,
    "sampling": "group_bernoulli_thinning",
    "seed": 42001
  },
  "projection_tolerance": {
    "atol": 1e-10,
    "rtol": 1e-10
  },
  "purpose": "pre_freeze_support",
  "registration_artifact_id": "aaaaaaaaaaaaaaaaaaaaaaaaaaaaaaaaaaaaaaaaaaaaaaaaaaaaaaaaaaaaaaaa",
  "schema_version": "h4l-joint-support-workflow-v1",
  "screening_policy_digest": "aaaaaaaaaaaaaaaaaaaaaaaaaaaaaaaaaaaaaaaaaaaaaaaaaaaaaaaaaaaaaaaa",
  "seeds": {
    "42": {
      "qualification": "valid",
      "scope": "synthetic_example"
    },
    "43": {
      "qualification": "valid",
      "scope": "synthetic_example"
    },
    "44": {
      "qualification": "valid",
      "scope": "synthetic_example"
    },
    "45": {
      "qualification": "valid",
      "scope": "synthetic_example"
    },
    "46": {
      "qualification": "valid",
      "scope": "synthetic_example"
    }
  },
  "status": "passed"
}
